Name,Title,aiconalt,View,State,View1,asizebase
vinay hinduja,Very good,5.0 out of 5 stars,Reviewed in India on 1 October 2018,Verified Purchase,"I am writing this review after 3+ years of use. This has traveled with me to foreign shores and been used frequently to make chutneys, Idli batter, grind spices and myraid uses.
The product is doing well, is durable. It has been packed into travel cases etc, with ease, it is definitely not delicate. It is reasonable easy to clean and the plastic has thankfully not turned yellow or colorful as some of them tend to.",446 people found this helpful
Gaurav,Worst product from bajaj,1.0 out of 5 stars,Reviewed in India on 15 September 2018,Verified Purchase,"Worst quality. The multi purpose jar caught rust in just 3 months. The chutney jar lid flips open while grinding even after applying enough pressure on the lid and on the 1 power mode.
No wonder why this product is always on deal as it is one of the worst product.",322 people found this helpful
Mr. Raj Guru,Facing problem,1.0 out of 5 stars,Reviewed in India on 18 November 2016,Verified Purchase,"Dear sir,
I've purchased Bajaj Rex 500-Watt Mixer from ur site in Aug,16 but now this is started smelling when its get switched on. So kindly do the needful.",563 people found this helpful
Guru Santosh,Bajaj logo is not convinced whether fack or original,1.0 out of 5 stars,Reviewed in India on 17 October 2020,Verified Purchase,Why product logo is not same as image shown in the amozon purchase bajaj logo. Is there any change.  I dont whether product is fack one. Need get answer from bajaj or amazon team. Customer will be in confusion if this question raises.,56 people found this helpful
Baisakhi Roy,Great Product no.1 best mixture,5.0 out of 5 stars,Reviewed in India on 27 May 2018,Verified Purchase,I'm statistics with this pocket friendly lighting deal offer price Indian's best mixture in my home m so so happy!!!,106 people found this helpful
Sudarshan,Defective product recieved,3.0 out of 5 stars,Reviewed in India on 21 January 2019,Verified Purchase,,72 people found this helpful
Monica,Had to return,2.0 out of 5 stars,Reviewed in India on 8 November 2018,Verified Purchase,Smallest jar is useful. Finally I could make cashew dip without water! My issue is with the largest jar. It can't even crush bananas or cucumber to make a decent juice. So what I have to do is make a paste in smallest jar and then make juice using it in the largest jar! Impractical. No thanks.,54 people found this helpful
Aditya,Good for everyday use.Value for Money !!!,4.0 out of 5 stars,Reviewed in India on 28 January 2019,Verified Purchase,"Pros
Comes with a 500watt motor Which does the job well,priced appropriate,easy to Handel jars, Good for nuclear family.

Cons
Very noisy ,jars are little bit small,material quality nd jar fitting are average..

Will post an update after further use.",45 people found this helpful
Aman Kashyap,"Cute and Powerful Mixer, but a Noisy Motor.",4.0 out of 5 stars,Reviewed in India on 1 May 2019,Verified Purchase,"The mixer can grind, mix and shake anything you put in it. It's really powerful.

But it's noisy as hell. Specially when you increase the pulse.

Talking about cleaning the jars & machine, it's never been easy on any entry level mixers. And it's the same with this one.

The best thing about this mixer is that it takes a little space in the kitchen.

Overall, I'd suggest you go for it if you're looking for a good deal.",31 people found this helpful
Saini A.,This is not orginel,1.0 out of 5 stars,Reviewed in India on 24 August 2020,Verified Purchase,I reacved a defictive proudct and missing spons.. It is not orginel so i return this item... 😈😡😡😡,24 people found this helpful
Madhumita,6 Stars!,5.0 out of 5 stars,"Reviewed in India on February 3, 2019",Verified Purchase,"Amazing value for money. It just does the job. Grinds well. I made chutney, dosa batter and juice. All were easy to make. There were no lumps. Most of my work got done on the 1st setting itself. For Dosa batter I had to use 3rd. The lid plastic is of good quality and the rubber inside the lid looks durable too. The main body stays in place while mixy is in use. I am very satisfied with this product.",25 people found this helpful
Renu ,Waste of money,3.0 out of 5 stars,"Reviewed in India on January 24, 2021",Verified Purchase,It is became faulty with in 6 months they serviced but again became faulty with 15 days...I am not suggesting to buy this model,15 people found this helpful
Sreejesh P V,My honest review about the  bajaj mixer which I received.,1.0 out of 5 stars,"Reviewed in India on January 3, 2021",Verified Purchase,"My honest review about the bajaj mixer which I received.
1. bought this after researching for a 500w mixer. Bajaj is one of the best brand.
2. Mixer looks entirely different from what is displayed in the image.
3. Looks ugly with multiple marks.
4. One jar i found cracks. image is attached.
5. Another jar steel looks black or dark.",9 people found this helpful
Argha Roy,Overall it is a good mixer grinder,4.0 out of 5 stars,"Reviewed in India on June 10, 2020",Verified Purchase,"Very powerful and great mixer grinder.
The only flaw is the lid of the jars, which do not provide a very good seal. At first there were no problems, but after six months the rubber ring washer gets a bit bend, which compromises the sealing and result is scattered half grinded half liquid mixture, which is quite a disaster !
The only soultion is to apply a great amount of pressure on the lid during mixing.

It would have been better if the rubber ring type washer was made in such a way that it would have covered the part where the jar's edge and lid's edge meets, that way it could have provided a greater sealing.",7 people found this helpful
Leslie P.,bad product,1.0 out of 5 stars,"Reviewed in India on August 24, 2021",Verified Purchase,Video Player is loading.,4 people found this helpful
KJK Ravi Theja,Best in 2k Budget,4.0 out of 5 stars,"Reviewed in India on January 8, 2021",Verified Purchase,"Pros:
Quiet equipment that results in less term oil when compared to other mixer grinders.
Superior quality containers
Convenient to clean
Sharp cutting edges that complete an amazing activity in grinding.
Easy to use for making shakes
Less energy consumption makes it quite simple in pockets.
Can operate on inverter or generator, so that you don’t need to stop and wait for power.
Cons:
Does not have four-speed accessibility features to perform better grinding
Wattage can be less for weightier errands.
No fruit channel is there to empty the mash that gets accumulated in the juice bump
Unlike other mixer grinders that are offered with a warranty for two years, this mixer grinder comes with a warranty for only a year.
It does not provide home administration.",4 people found this helpful
PARTHA PROTIM MUKHERJEE,Awesome Purchase,5.0 out of 5 stars,"Reviewed in India on February 17, 2020",Verified Purchase,"Used it over 2 years and this product has performed excellent . It has very easy to make chutneys, grind spices , making batter and for other uses too.
Still now faced no problem with the product and has been doing well. Packing has been excellent making it easy to carry wherever required . It makes a sound a bit more when compared with some but is reasonable easy to clean and use.",7 people found this helpful
Bhargav Thota,Average,3.0 out of 5 stars,"Reviewed in India on April 15, 2019",Verified Purchase,"When i get this product one of the jar was broken.......
Otherwise looking was good
More over sound was pretty loud.....
The main problem here is the customer care...they are not responding very well and they are not full fill my dameges......
And i given 3 star for this product...",16 people found this helpful
Arun Bhatt,Not able to grind very fine,3.0 out of 5 stars,"Reviewed in India on October 3, 2021",Verified Purchase,"It is not able to grind the tomato properly to make a puree when you put big pieces of tomato. Only when pieces are cut fine, it will make fine puree. Same is the case with coconut chutney where if there are big pieces of coconut it will not be able to grind it properly. Also noise level is high as compared to other brand grinders. Before this I had Usha food processor which was good in grinding. Though to give Bajaj grinder a try considering it was coming as best seller in Amazon but disappointed with its performance",3 people found this helpful
Sumit,Nice kitchen applances......,5.0 out of 5 stars,"Reviewed in India on March 15, 2019",Verified Purchase,"Motor RPM is so good therefore you can use this product continuously...... Blade is so good that's why it will grind or mixing very fast... Product weight is also not so heavy, hence you can easily carry... very important thing is main power cable which is made from good quality and also it is so long .... it comes with 3 jar. You can use for mixing. grinding and juicing purpose....",8 people found this helpful
Felix,My mom's 5 years experience!,2.0 out of 5 stars,"Reviewed in India on July 28, 2020",Verified Purchase,"I am writing this review after 5 year's of usage. Product is not sturdy. Lots of leaks while grinding. You must be holding it tight always. The rubber gasket is of poor quality. Material is not upto the mark. Since this is only 500Watts, it doesn't grind smoothly. There are hard pieces left over and while grinding auto rickshaws noise is definitely available. Too loud.",4 people found this helpful
vijay Mishra,Quality of the product is not up to mark. ...,1.0 out of 5 stars,"Reviewed in India on July 16, 2017",Verified Purchase,Quality of  the product is not up to mark. Mixer jamed with first use. Returned immediately. Thanks Amazon for quick response.,28 people found this helpful
subham samantray,It is apt for rare use,3.0 out of 5 stars,"Reviewed in India on June 26, 2021",Verified Purchase,"So all in all it is completely apt for bachelors, who do rare use of grinder. What I feel it is not ideal for family use, as we need frequent use it. Below are some points that need to be considered before buying it.
1. 1st and most important, very noisy, can't be tolerated for long period of time.
2. Jar lids are not good enough for the speed, you will have put your hand on it while grinding or else it ll just throw it out.
3. It is getting heated very quickly and untouchable rather after 2/3 minutes of action.

So these are the main issues that I could able to find out in 3months of use and hope it stays this much only.

Apart from this good things about this mixer are
Affordable, vaccum rubber stand",2 people found this helpful
Lisa,Worst quality,1.0 out of 5 stars,"Reviewed in India on February 8, 2019",Verified Purchase,"Even after grinding for 45 mins a simple daily coconut gravy doesn't get grind finely... The blades are small and not sharp
Wastes too much time. Mixer is good .. But jars are of no use...",10 people found this helpful
Roli Pal,Nice product!,4.0 out of 5 stars,"Reviewed in India on May 31, 2018",Verified Purchase,"Using it for the past 6 months and it works great without any problems.
The container blades are quite strong and can mix even the hard food items easily like dry fruits/grains etc.
Overall the product is quite sturdy and aesthetic too.",14 people found this helpful
R,Perfect,5.0 out of 5 stars,"Reviewed in India on June 19, 2021",Verified Purchase,"It's a good machine.
It was received in good condition without any breakages or flaws as I saw in numerous reviews hence was a little skeptical, but nothing of the sought happened.
However it falls behind on the following pointers:
1. You cannot make the batter for idlis and dosa since it cannot be run for a longer duration, reason being of low wattage of 500 watts. The cutoff switch at the base gets activated and the machine stops . Then I had to switch over to my old Sujata powermatic which is of 900watts and can be run for a longer duration.
2. Sound made on using the machine is much higher, but that's not an issue if it does its work well.
However I loved the mixer grinder as it makes milkshakes, smoothies chutneys and small portions of grinding Dal for dahi vadas and kachories and fresh masalas on a regular basis.",
Asha L Moorthy,"Small good, medium and large useless",4.0 out of 5 stars,"Reviewed in India on May 16, 2019",Verified Purchase,"The medium and large jars are pretty much useless when it come to grinding anything.. For making gravy, etc., you can use only the small chutney jar, which I have to say, grinds beautifully.. Months after I bought this, mom gave me a spare 4 side blade of hers, which I used on the large jar, and it works beautifully! I really wish I had received such a useful blade in the medium or large jars, instead of the completely useless ones i received with this order",5 people found this helpful
Arpita Ganguli,Good Kitchen Appliance at This Price,5.0 out of 5 stars,"Reviewed in India on August 15, 2021",Verified Purchase,"I chose this product mainly because the Bajaj brand name has been a trusted one for a long time. I am highly satisfied with this product. It gets the work done. I use it mainly to grind spices, mix ingredients for cakes and bread, pulp coriander leaves, etc.

Yes, it is a noisy appliance - but I guess that's because of the powerful 500 Watt motor. When it is in operation one can't hear anything on one's phone or on the television. Yup, it's that loud!

As far as looks are concerned, the design is quite basic... no great shakes. But I would prefer a durable hard-working appliance over a less efficient but pretty looking one any day.

I have been using this Mixer-Grinder for the past six months or so, almost on a daily basis, and it's working fine. No problems.",
Amazon Customer,Not efficient. very noisy. worst experience.,1.0 out of 5 stars,"Reviewed in India on September 8, 2019",Verified Purchase,"I am writing this comment after using this mixer more than 3 months and I'll not recommend this to others. I am very surprised how did this product get 4+ ratings.
Smallest jar only can cut the material. Bigger jars are not able chop banana itself and can be used only for mixing purpose. Every time two jars need to be used. Smaller for chopping and bigger for mixing.
It is like a 20 years old car which makes lot of noise but can not produce power.
Please note these anomalies are not piece specific. This seems to be a design issue.",6 people found this helpful
pratik sherlekar,Good product but worst delivery,5.0 out of 5 stars,"Reviewed in India on October 13, 2021",Verified Purchase,No issues with the product... the delivery of this product was at its worst!! The delivery guys asked me to come 3 to 4kms away from the house for his convenience saying that he won't be able to come and if I don't go to pick it up he will return the product. Not at all expected this from Amazon delivery. Much disappointed!!,2 people found this helpful
Victor,Best Mixer Grinder for Rs. 1799,5.0 out of 5 stars,"Reviewed in India on October 31, 2020",Verified Purchase,"It's a quality product for Rs. 1799. The design, plastic material, jars, fittings, rubber, everything is 100% perfect. I am extremely pleased.

Earlier, I bought another mixer from Lifelong for Rs. 1100 3-4 days back but returned it as I didn't like the quality of the product. Hence, I went with Bajaj because of the brand. I am happy that Bajaj stood true to their brand. They have a superior quality.

If you have the lowest budget for a mixer grinder, Bajaj Rex is the best in it's class. It's worth the extra Rs. 700 than a nonbranded product.",
Nano,Awesome mixer grinder!,5.0 out of 5 stars,"Reviewed in India on June 19, 2020",Verified Purchase,"It's a really good mixer grinder! Locking feature is easy, it's easy to clean and takes up less space on the kitchen counter. The motor works perfectly. 👌 It is a bit noisy but that doesn't really matter for me, the output does. Now all my mixing, grinding and chutney making needs are being met easily with it. 😊 If you are looking for a cost-effective and well functioning mixer grinder, go for this.",2 people found this helpful
Kishor Kumar K,Received Bad Quality from Bajaj,1.0 out of 5 stars,"Reviewed in India on January 3, 2019",Verified Purchase,"Received Package in Good Condition, but hearing abnormal sound when removed the Grinder from Package - some loose or damaged part inside the Grinder
Never expected from Bajaj such a poor Quality Product.",9 people found this helpful
pratik nazareth,Stopped working in the first use,1.0 out of 5 stars,"Reviewed in India on October 27, 2021",Verified Purchase,"Extremely pathetic as it stopped working in the first use, unfortunately I was away and used it after its 1p day replacement policy, but as soon as I tried to grind masala in it, it stopped working. Thought it was over loaded but I had not more than 100 grams of masala in it. I have been using other mixers with masala more than this at same wattage. This couldn't take even that much and gave up. I would suggest to go for some other mixer as this doesn't have the strength. Plus the body of the mixer also is made of cheap plastic. Opt for instore mixers rather than online ones.",
Mr. Kay,Great! Works just fine! No problems at all,4.0 out of 5 stars,"Reviewed in India on July 11, 2020",Verified Purchase,"Ok so i have been using this for almost 2 months now. So here’s my review.

Trusted brand, good build quality, looks just like in the pictures (hence i am not putting any)

All jars work beautifully..all do their job..grinding, mixing.. everything is done well. Not too noisy, doesn’t vibrate too much.
Lid fits just fine, you don’t need to hold it down while running.
Easy to clean. price is adequate too.
Overall a great buy! Go for it",One person found this helpful
geniezlife,"Average product, can look at other options",3.0 out of 5 stars,"Reviewed in India on September 18, 2019",Verified Purchase,"Bought in April 2018, so reviewing it after nearly 1.5 years of use.

What I liked:
- Blades are sharp and very effective. Nothing to complain about even after 1.5 years of regular use
- Compact and occupies less space on the kitchen counter
- Elegant looks and aesthetics at a reasonable price
- Stays planted on the counter with its anti-skid grip on the base

What I hated:
- Of the 3 jars, one jar cracked after less than 6 months of use
- The plastic part at the base of another broke after 1.5 years, so left with only one usable jar (and to my bad luck, it is the smallest jar)
- Noise level is uncomfortable on the ear. Not sure if any other mixer in this price range is much quieter though

Overall:
- If it lasts, it works great. However, longevity is not something I will expect from this product
- Satisfied but not thrilled. If I had to purchase a new product around this price point, I would look at other options",One person found this helpful
Subhankar Dey,Great Mixer Grinder for the price!,4.0 out of 5 stars,"Reviewed in India on January 19, 2019",Verified Purchase,"I have been using this product for a few months now. When I was on the lookout for a mixer grinder, I browsed many mixer grinders before making this my final choice. First things first, there are way better mixer grinders than this one, but this mixer grinder is the best in this price range.

The mixer grinder comes in a good package and the material quality is great. It's easy to clean and after using it some months I can confirm it's very durable. Fast grinding speed, and power consumption is moderate (better than other ones in the range).

One thing that came to my notice is the sound of this thing. It's a bit loud, but you can't complain considering the price. This won't be a big factor, and I think you should definitely go this awesome product.",One person found this helpful
Siva,Only 6 months running after repair theories no warranty on ...,1.0 out of 5 stars,"Reviewed in India on December 23, 2017",Verified Purchase,Only 6 months running after repair theories no warranty on this product display is 1 year warranty but no warranty,18 people found this helpful
SANJAY MISHRA,Good mixer. Does the work efficiently.,5.0 out of 5 stars,"Reviewed in India on November 30, 2021",Verified Purchase,I am writing this review almost after using this grinder for 3-4 months. Overall the mixer grinder is very nice. Small jar is good for grinding in small amount. It's best for dry grinding. If making chutney make sur the jar is half loaded or else it will spill. Follow instructions. Do not grind more than 1 min then 3 min rest then again 1 min grinding. It's not at all time taking. 1 min of grinding does the work satisfactorily. Do not wet wash the motor more often. Till date I have washed the base under water only thrice and it's working very well. Do not frequently remove the cover rubber gasket orelse it will become loose and eventually break.,
Vish,Poor quality,1.0 out of 5 stars,"Reviewed in India on May 24, 2021",Verified Purchase,"One jug came broken from down, noise level is massive l, everything spills out, quality is very poor was using inalsa before this thought id buy bajaj being an old known brand m, very disappointed",2 people found this helpful
Sheikh Moinul Islam,Original or a duplicate product as there is change in logo and hologram !,2.0 out of 5 stars,"Reviewed in India on July 28, 2020",Verified Purchase,"I am unable to understand one thing which I want to know from Amazon,in the Amazon website when I saw the product the hologram or the logo of Bajaj is shown in blue and red colour sticker as well Rex 500 is also mentioned in the motor of the Mixer Grinder in blue colour,but the mixer which I had received is completely different where the hologram and logo of Bajaj is mentioned in Black and White.

Am unable to understand,have you delivered me a duplicate product please look into this issue very seriously.

Need an appropriate answer to my question please !",One person found this helpful
abhishek s.,Don't buy this mixer by only trusting BAJAJ. Read full review for detail.,1.0 out of 5 stars,"Reviewed in India on August 16, 2021",Verified Purchase,"I purchased this mixer by thinking brand name of BAJAJ and ofcourse overrating of 4. I doubt that it is used before because of the black scratches on the inner parts of the mixer and blades of the mixer. Though, the smallest jar is good at grinding raw masalas. But its middle one and bigger jars are of no use. because even it can not chop two bananas and apple added with enough milk even after grinding it upto 7 minutes. The noise level of mixer is too high. But grinding capacity is too low. Thought to return and buy some other good brand's mixer but no option left as only replacement is possible. So, I suggest dont buy this by seeing its overrating and BAJAJ brand name. You will regret as me.",
Raji,Good product,4.0 out of 5 stars,"Reviewed in India on October 4, 2020",Verified Purchase,"I have been using this recently and have had no problem with it so far. If one takes the usual care it works well. That is, we should not to overload the jar or run it for  a long time without a break. It's better to stop every five minutes or so.",2 people found this helpful
Mahesh Palav,Defective mixer grinder,1.0 out of 5 stars,"Reviewed in India on June 23, 2021",Verified Purchase,Not satisfied with Bajaj mixer grinder as the product is defective and non returnable. This is the second mixer grinder I have ordered from Bajaj and it was a defective product. If Bajaj wants to keep non returnable policy then they should check for product quality at their end before dispatching it to the customer. Zero customer satisfaction from my end. Lost faith in the brand.,
Riya C.,Good product at this range,4.0 out of 5 stars,"Reviewed in India on December 27, 2018",Verified Purchase,"1stly the packing of the product is good.. And the machine and jars are also good.. But while grinding it's stopped suddenly I don't know why after that I restarted then it's work properly..
2ndly it's worth of money..
I would recommend you to buy this product.. It's good.. I give 4 out of 5 to this product.. ⏳",9 people found this helpful
ATISH,Don't buy bajaj mixers online. It is not serviceable as per service centre rejected the log.,1.0 out of 5 stars,"Reviewed in India on July 30, 2020",Verified Purchase,Worst customer service. The product delivered is faulty. The middle jar is not working properly. The spatula is missing. I have launched complaint on bajaj customer service. They sent their service person and told that online products are not serviceable. Then again I called the customer service center. They said that the jar or any cosmetics have no warranty. So in this situation I am helpless. My suggestion is don't buy any product from online which is to be daily used.,One person found this helpful
K Shalini Raj K,Super Fast grinder,4.0 out of 5 stars,"Reviewed in India on September 20, 2021",Verified Purchase,"Prefect gift for house warming n wedding... 3 jars inside box.. this is the second time i purchased this product. Bajaj still maintains the quality of product.

No complains so far. Worth buying - only white colour mixer is available.

Small and compact 👍

Overall 4 stars - reduced one star for price.",
D A,Very useful,4.0 out of 5 stars,"Reviewed in India on June 19, 2019",Verified Purchase,"Very useful..
I have no issue with noise level nor in cleaning n of course very easy to use as well. I use to grind garam masala in smallest jar. N dry chillies, n many more in middle jar. N in large jar i make juices of banana, mango, watermelon n my protein shake. Wanted it for so long time. Thanks Amazon.",4 people found this helpful
