Name,Title,aiconalt,View,State,View1,asizebase
Aniket Goel,Excellent Service Provided,5.0 out of 5 stars,"Reviewed in India on April 13, 2021",Verified Purchase,"Giving a full review rating because of the fact that there was a mechanical fault in the knob after 8 months of use, I logged a complaint on toll free number of bajaj, they got it fixed under warranty within 6 hours. What a relief.",
Gokulnath AD,Easy and Super grinding,5.0 out of 5 stars,"Reviewed in India on July 7, 2021",Verified Purchase,Purchased without Juicer since we don't use it much for long time.. Very nice and easy to handle and performance also good,
Aditi Juneja,Everything good but broken one lid,3.0 out of 5 stars,"Reviewed in India on February 3, 2022",Verified Purchase,Everything is ok...but one of the lid is broken..very disappointing..coz have to give it to someone..and replacing is taking a lot of time...so have to keep it...,
Rehan,Best in the market,5.0 out of 5 stars,"Reviewed in India on November 28, 2020",Verified Purchase,"I bought two mixers before..but no one had that much perfect grinding..
This one is best product,but a little bit noisy
Over all best mixee in this range..",
Maria Frenny,Cheap quality of steel and plastic holder,2.0 out of 5 stars,"Reviewed in India on April 16, 2021",Verified Purchase,"The quality is very poor. For the very first time I got a duplicate product from Amazon.
Why is this Amazon's choice? Not worth it.. quality of the steel and the plastic holder is very bad.. definitely bajaj wouldn't manufactur such a bad quality product. Don't know if I can rely on ""Amazons choice"" to buy any product anymore.",
manish sharma,Worth Price with few cons,4.0 out of 5 stars,"Reviewed in India on January 23, 2021",Verified Purchase,"I've been using it for a month now and the problem that i faced is that chutney jar is small and and if you fill it upto lid and try to grind it, lid opens up by the pressure even if you're covering the lid by your hands. So don't fill your chutney jar upto lid.",
Sayantani Mukherjee,Your friend in the kitchen,4.0 out of 5 stars,"Reviewed in India on January 31, 2019",Verified Purchase,"I was a bit sceptical of buying the mixer grinder online but thanks to amazon it was delivered in perfecf condition. There are 3 jars. The motor is perfect and grinds even pulses in minutes. However, I would have liked better if the jars had transparent lids.",
Shaina,I like it,4.0 out of 5 stars,"Reviewed in India on April 12, 2021",Verified Purchase,,
AM,Disappointed! Don't trust the star ratings on the product.,1.0 out of 5 stars,"Reviewed in India on July 25, 2020",Verified Purchase,"I had a 25 years old Jaipan mixture which was still working but we bought this to get an upgrade. Unfortunately, it turned out to be a downgrade for us. Our old mixture was much better than this one. Atleast it did the job. The blades are blunt, can't even blend an apple. Very disappointed. I am surprised how did it get such a good star rating.",
Jay,Cheap only for basic purpose,3.0 out of 5 stars,"Reviewed in India on June 20, 2022",Verified Purchase,"The starting price this mixer comes at is fine, but you will not like its quality after long usage.Spend a little money and go for good quality.",
Parshant Chopra,Good product.,5.0 out of 5 stars,"Reviewed in India on August 3, 2020",Verified Purchase,Its a nice product by bajaj. Lookwise it is less attractive than others but it is dependable.500watt is enough for crushing almonds etc.So you can go for it without any doubt.,
Abhinav P.,Below then average,2.0 out of 5 stars,"Reviewed in India on November 15, 2019",Verified Purchase,"After Going through the product, Below points i observed:-
1. Jar Quality and blades are not good even below then average, could be better.
2. Plastic quality is also not good, didn't seems to be long runner, although design and space consumption is good.
3. i think liquid jar is not capable of breaking the ice cubes to crush for shakes.",
Manglesh shimla,Highly recommended,5.0 out of 5 stars,"Reviewed in India on June 20, 2021",Verified Purchase,At this price it beats my philip mixer. As it is 500 watt but it take same time to complete work 750watts other mixer. Highly recommended to all.,
FYM,Good product with a couple of cons,5.0 out of 5 stars,"Reviewed in India on January 29, 2021",Verified Purchase,The product is good .. as expected from Bajaj. Noise level is a bit high. There is no lock feature - I could turn the mixie on even without any jar in place.,
nikhil,Noisy and poor lids but works,5.0 out of 5 stars,"Reviewed in India on January 8, 2022",Verified Purchase,"Noisy
When you blend liquids, it could easily open it's lid and give you a mess to clean",
nimish agarwal,Acceptable performance.... high noise,3.0 out of 5 stars,"Reviewed in India on July 27, 2020",Verified Purchase,"Noise is too much to handle. performance is also not up to expectations.  I will not suggest for this mixer, instead try another one. I was about to return the product but  missed the return deadline.",
Sumit tiwari,Mixer,3.0 out of 5 stars,"Reviewed in India on January 10, 2021",Verified Purchase,Bajaj mixer grinder quality was good and their jar quality was also good 3 jar available with this Bajaj mixer grinder. But cost is too much...,
Amazon Customer,Broken piece received,1.0 out of 5 stars,"Reviewed in India on November 1, 2020",Verified Purchase,I have received broken piece. I have never expected the same from Bajaj and Amazn. They should always check product before packaging. Broken piece can be easily pointed out. Now I will have to replace the product but it wasted my time.,
Santhosh,Disappointed,3.0 out of 5 stars,"Reviewed in India on January 31, 2022",Verified Purchase,First time the order was sent with a broken wire. We have returned it. Now again it was sent with broken part for the small jar. Very disappointed.,
P Saha,Good Product,5.0 out of 5 stars,"Reviewed in India on December 14, 2020",Verified Purchase,A very good product..Just Go for it..A bit Burning Smell will come in the beginning but it's not a technical default..A very good product at a much reasonable price..,
MONADITYA,Ordinary kind of product,3.0 out of 5 stars,"Reviewed in India on October 16, 2019",Verified Purchase,"Ordinary kind of product.
High noise level speaks about its quality.
The minching blade functions poorly. It can't even make good onion paste.",One person found this helpful
Somesh Pandey,"Cheap, simple and reliable.",4.0 out of 5 stars,"Reviewed in India on February 4, 2022",Verified Purchase,"Great product from a well known brand for cheap price, delivery was also very fast.",
Ritu,It was good product but I received broken Lidlid,3.0 out of 5 stars,"Reviewed in India on February 13, 2022",Verified Purchase,It was ok ok product I got broken lid  but it was for my maid so kept it,
Lakhan Panwar,"One Jar is broken, Replace",1.0 out of 5 stars,"Reviewed in India on July 17, 2020",Verified Purchase,"Got Broken Jar, I got the package I opened it and checked mixer working with one Biggest Jar, did not check all of the Jar's below plastic gear.

Today we wanted to use mixer for spices, when i checked for smaller Jar base plastic gear is broken.
I want replacement for this, please help.",
Suman Dey7,Good in this budget,4.0 out of 5 stars,"Reviewed in India on August 14, 2020",Verified Purchase,"afyer using it for 1 year i must say this is good mixer grinder in this budget, i got this for 1699rs.
cons are it cannot totally grind various type daals except masur because masur is soft as compared to other daals",One person found this helpful
Ajeet K.,poor quality and very bad service,1.0 out of 5 stars,"Reviewed in India on August 31, 2020",Verified Purchase,"Small Jar stopped in three months, poor quality of this product. it is saying that one year warranty but within three month when i raised request for fixing Jar, then after two week got response saying that warranty for Jar is only three month. now you can understand what is quality and service and commitment on warranty.",
sanjeev kumar pandit,Product is defactive after 1month,1.0 out of 5 stars,"Reviewed in India on April 29, 2021",Verified Purchase,"I have purchase this last month ,after one month it is not working ,I suggest you don't purchase Bajaj mixer",
Augustine,Too much noise,4.0 out of 5 stars,"Reviewed in India on June 19, 2020",Verified Purchase,Bajaj a household name. The rex mixer grinder had good looks. The noise is on the higher side and it's a lot more than the other mixers in that range.,
BASANT KUMAR PRADHAN,Damaged after used 1st time.,1.0 out of 5 stars,"Reviewed in India on July 11, 2022",Verified Purchase,Im truly speaking  Product not good and when start 1st time damaged the mixer grinder plastic parts.,
Nikhil,Good product for this price,4.0 out of 5 stars,"Reviewed in India on July 28, 2021",Verified Purchase,"Good product for this cost.
Compact size is advantageous for storage.
Have used only for usual grinding use like dry spices, ginger garlic, onion etc.",
Parth Mitra,Good,4.0 out of 5 stars,"Reviewed in India on January 31, 2021",Verified Purchase,"After one week of use some screws came out and I was little disappointed!
I called the bajaj customer care and within a day's time the service person came and repaired it for free. Now, I am using it for almost 5 months, it's running perfectly fine. Just remember the long jar doesnt work for grinding.",
Rakesh t.,Missing items,2.0 out of 5 stars,"Reviewed in India on January 9, 2022",Verified Purchase,"Whole product is nice , but plastic knife was missing in this , and packaging was worse , worn box",
Suhas khatke,Mixure,5.0 out of 5 stars,"Reviewed in India on November 23, 2020",Verified Purchase,Oh my god very nice mixure grinder👍👍👍👍👍👍👍👍👍👍👍👍👍👍👍👍👍👍👍👍👍👍👍👍👍👍👍👍👍👍👍👍👍👍👍👍👍👍👍👍👍👍👍👍👍👍👍👍👍👍👍👍👍👍👍👍👍👍👍👍👍👍👍👍👍👍👍👍👍👍👍👍👍👍👍👍👍👍👍👍👍👍👍👍👍👍👍👍👍👍👍👍👍👍👍👍👍👍👍👍👍👍👍👍👍👍👍👍👍👍👍👍👍👍👍👍👍👍👍👍👍👍👍👍👍👍👍👍👍👍👍👍👍👍👍👍👍,
Bharat,bad product,1.0 out of 5 stars,"Reviewed in India on November 16, 2020",Verified Purchase,i Received damage and third class product... quality of the steel is very thin.. and locks are also very soft quality... amazon delivery agents are also vvery care less they. should take care if the product can be damagible.,
Amazon Customer,Noisy mixer,3.0 out of 5 stars,"Reviewed in India on July 10, 2020",Verified Purchase,Very disapointed in the piece I received. This particular piece was extremely noisy. We have been using a Bajaj mixer for over 10 years - that old mixer was much quieter.,
Shamanth,Small and light weight,5.0 out of 5 stars,"Reviewed in India on December 31, 2021",Verified Purchase,"Pros : looks gud.. light weight.. easy to clean.
Cons: Sound is loud..",
MD.Ahamadi,Delicate mixer grinder.mixer is running very shaking...,3.0 out of 5 stars,"Reviewed in India on September 27, 2021",Verified Purchase,Small jar is not working properly.very delicate mixer grinder. and mixy is shaking.first time iam taking bad product in Amazon.. mostly taken items is good.but this mixer grinder is very bad experience in my life....,
akarsh a.,Bad build quality not recommend,2.0 out of 5 stars,"Reviewed in India on June 4, 2021",Verified Purchase,First of all the packaging is the worst that I have seen in many years it's like buying from a fake site also the product is poorly constructed the quality is just cheap not Bajaj standard so a big disappointment from bajaj .. I will not recommend this product at all.,
Tshering Dukpa,Overall a perfect mixer grinder!,5.0 out of 5 stars,"Reviewed in India on March 10, 2022",Verified Purchase,"Awesome product, love ❤ it. Go for it without any hesitation!!",
HARI VENU,Mixer grinder working good but jar's quality not good,2.0 out of 5 stars,"Reviewed in India on June 17, 2020",Verified Purchase,After 3 months one jar leaked water also the blade are stop rotating. Not expected from Bajaj product.,One person found this helpful
Amazon Customer,Very good,5.0 out of 5 stars,"Reviewed in India on June 10, 2022",Verified Purchase,इस मिक्सर को खरीदने के बाद आज पर्यंत तक लगातार चल रहा है यह अमेजॉन की टीम को मैं बहुत-बहुत धन्यवाद देता हूं बहुत ही अच्छा प्रोडक्ट है,
Ambreen,Duplicate product,1.0 out of 5 stars,"Reviewed in India on August 21, 2019",Verified Purchase,"Duplicate product... Jars were duplicate too as I get them checked.
Noise level is too much
Jars blades cannot even blend curd...
I want to return the product",One person found this helpful
Anjan Barik,Stopped running...,1.0 out of 5 stars,"Reviewed in India on March 6, 2022",Verified Purchase,I was grinding rice but it was stopped and after one day it's not working. And it take to service station they are told me that it need to repair. Dear seller will you return your product? This is not working now...,
Harish,Sturdy little !,5.0 out of 5 stars,"Reviewed in India on August 7, 2020",Verified Purchase,"Sturdy product. Lasted for 3 years. When I bought it was priced less compared to peers. Nevertheless the product lasted rough handling, the blades are still good. It travelled extensively. Still as good as new.",One person found this helpful
Dipanwita Singha,Good one,4.0 out of 5 stars,"Reviewed in India on December 13, 2019",Verified Purchase,Always go for a branded product as they can be serviced if there is any fault. Though noise level is high but works great.,One person found this helpful
Dibyalochan,Cheap n Best.,5.0 out of 5 stars,"Reviewed in India on January 10, 2022",Verified Purchase,"Purchased with ₹1400/- during Diwali offer and performance is super. Copper coil, 500wt light weight do grinding properly.",One person found this helpful
Ankur Thakur,Very easy to handle,5.0 out of 5 stars,"Reviewed in India on August 16, 2019",Verified Purchase,"This is my second purchase of the very same product, this time I bought it for one of my family members and needless to say it's working great. No qualms about it. A great product.",
Jiten,Water leaking,1.0 out of 5 stars,"Reviewed in India on January 23, 2020",Verified Purchase,"I bought  on 22 Jan 20 , and I checked jar leaking water . 23 Jan I return this product, and  I got full refund in Amazon pay balance.Amazon service is good.",
Anuj,Good for normal use,5.0 out of 5 stars,"Reviewed in India on September 29, 2020",Verified Purchase,I got this in under 2000 and I m happy with it it full fill my all basic needs its no for hard use like turmeric and in starting you should start it by giving some jurck,
Rauf,Worst product &Service i have came across ever,1.0 out of 5 stars,"Reviewed in India on January 15, 2021",Verified Purchase,"Within in a week, it stopped working.. And morever the service team of bajaj are not responding any mail Or any phone call
I think it's better to buy directly as well instead of online, in that case you can go directly to the seller for any issue if service team of any company not responding",
lakshmi menon,Good Quality & Made in India,4.0 out of 5 stars,"Reviewed in India on July 28, 2020",Verified Purchase,"Noise level is not loud or annoying and it is easy to clean. It is sturdy and I know I can depend on Bajaj Brand. Am also happy I bought a ""Made in India"" good quality product.",
Pallab,Not long lasting product,1.0 out of 5 stars,"Reviewed in India on October 5, 2021",Verified Purchase,After using 1yrs the jar is got damaged. Build quality should be more good.,
zeba khan,Very bad performance,1.0 out of 5 stars,"Reviewed in India on October 27, 2020",Verified Purchase,"Whoever wants a genuine review then please dont order it, i tried to blend onions and there were pieces left in it. Dont order this one at all.",
Amazon Customer,Defective product,1.0 out of 5 stars,"Reviewed in India on December 23, 2021",Verified Purchase,"The Bajaj mixer grinder was delivered yesterday. Today morning when we fixed it, the motor didn't start at all. We needed it badly for chutney but there was no helpline mentioned on the papers. Have asked for replacement. Hope that works.",
Sangeetha Raghunathan,Utilatarian mixie at reasonable price,4.0 out of 5 stars,"Reviewed in India on March 10, 2020",Verified Purchase,"Efficient and easy-to-use mixie at reasonable price.

However, very high decibel in operation .

Also, the fit of the jars, especially the large wet jar, is way too tight for comfort. This is a big put off.",
Sandeep Anapurapu,Hangs often,2.0 out of 5 stars,"Reviewed in India on October 28, 2019",Verified Purchase,"This was the worst thing..it suddenly stops while grinding small things like onions, every time we have to switch overload and wait..the item was lacking one srcrew and was damaged inside, we noticed it very late, could not return..and raised a service request , eventhough its on warranty service engineer collected money..for traveling purpose..since my home is too far..",
Vinay Kumar M,Content Spills out from chutney jar,2.0 out of 5 stars,"Reviewed in India on May 9, 2019",Verified Purchase,I'm using this from more than an year. It's ok ok product. My mother scolds me everyday for buying this cheap product. The content Spills out from chutney jar as lid's rubber is loose.,
Sanen,Review after 4 months,4.0 out of 5 stars,"Reviewed in India on May 5, 2019",Verified Purchase,"Writing after 4 months of use.
Received the product safe and sound.
It's easy to use but make a quite loud noise when using.
Yet no problem till now apart from noise level.
Giving the fact it it is budget friendly.",
Amazon Customer,Very good mixer.,4.0 out of 5 stars,"Reviewed in India on January 19, 2022",Verified Purchase,"I was hesitant to buy the mixer online. But during covid, we have to buy it online. But it is very good. Noise is average. Performance is good. Jars size is good. At this price it is very good
Go for it.",
NV,"Mixer not working, hence returned",1.0 out of 5 stars,"Reviewed in India on September 20, 2018",Verified Purchase,"The product was not working, hence returned the product.
But planning to re order the same. Will again review after its delivered",3 people found this helpful
SHIV CHAITAN,Beat item,5.0 out of 5 stars,"Reviewed in India on September 28, 2021",Verified Purchase,"Review after used of 2.5 year (approx)

Product is very good, till now there is no problem.",One person found this helpful
Shan,Not good,1.0 out of 5 stars,"Reviewed in India on June 21, 2021",Verified Purchase,"Not worth. All the jars are waste, except the smallest one. Not able to blend liquid consistency items(you can not make juice).",
Ramkrishna halder,Quite Good.....,4.0 out of 5 stars,"Reviewed in India on October 22, 2020",Verified Purchase,"I ordered this product on Great Indian sale on 2020 October.
Today I receive the product.
First impression is quite Good. Good packing, no fault on product, on time delivery, little noisy , quality good.
You can go for this. Also bajaj is best selling mixture on it's range.",
Surbhi Thakur,Excellent product,4.0 out of 5 stars,"Reviewed in India on November 19, 2020",Verified Purchase,I liked this product very much.....easy to clean ..... Bajaj rex is very nice mixer...You should buy it ...its grinds very fine....and chutney jar also works wonder fully...also the jar works very nicely... There is no need to worry about the watts for home purposes..its wonderful..,
Mikey August,Go for it.,5.0 out of 5 stars,"Reviewed in India on September 11, 2020",Verified Purchase,A little noisy but gets the job done efficiently. Have been using it for over 3 years now and have no complaints whatsoever.,
Dinesh,Very less blades in the jar when compare to others.,2.0 out of 5 stars,"Reviewed in India on June 11, 2019",Verified Purchase,Blades in the jar are very less and thus it is not grinding properly. Go for juicer. Even local brand have more blades in jar thus they are doing great job at grinding/ mixing .,
Super reviewer,Looking like bajaj copy,2.0 out of 5 stars,"Reviewed in India on January 21, 2022",Verified Purchase,"Looking like old bajaj mixer.jar is not like solid steel but like light tin.cover of jar is made of local plastic with rubber grip.
Lower black portion of jar is not finished well.",
MK,Do not recommend this,1.0 out of 5 stars,"Reviewed in India on July 6, 2022",Verified Purchase,"Not happy with this product.
Doesn’t do the job.
Would be happy if could return and get refund for this.
Do not recommend.",
Ravikant Gupta,Value for money,5.0 out of 5 stars,"Reviewed in India on May 24, 2022",Verified Purchase,I am giving this review after using almost 2 years and it's been working so good until now without any problem. This mixer is being used for daily normal kitchen activity and it's worth buying it .,
priyanka,Totally satisfied,5.0 out of 5 stars,"Reviewed in India on December 27, 2021",Verified Purchase,Must buy product. Normal price range quite affordable. Go for it. Happy with tjis purchase,One person found this helpful
Devesh,"Perfect size, blades could be better",4.0 out of 5 stars,"Reviewed in India on August 14, 2019",Verified Purchase,"Found the size perfect -- very compact, looks good on the kitchen worktop. Noise level, etc are just like that of any other make. The blades could be better though.",
Sudhir Singh,"Not good not bad ,can buy in this range",4.0 out of 5 stars,"Reviewed in India on August 29, 2020",Verified Purchase,"Writting after 2 month use,overall ok ok only
Only one issue u need to put ur hand on cover else it will be flowing in ur kitchen",
Himesh Mishra,Not Good product,1.0 out of 5 stars,"Reviewed in India on October 28, 2021",Verified Purchase,Product stop working after 1 year of use. Such thing from bajaj is not expected..once warranty is over next day product stop working..,
Soumya Ranjan Jena ,Nice in this budget,4.0 out of 5 stars,"Reviewed in India on November 9, 2019",Verified Purchase,Good for small families....I am using last three to four months.its performance is looks good and very easy to handle. My wife quite happy with it. For bigger families please go for other models.,
Arghya Mukherjee,Worst Product,1.0 out of 5 stars,"Reviewed in India on July 5, 2021",Verified Purchase,"Worst product, the product is not working within just two months and stupid Bajaj customer care are clearly saying due to covid we cannot give support right now. Don't buy this product. This will cause you more hazard than normal. Very bad product.",
Vicky,"Jar quality is very poor, and somewhat noisy",1.0 out of 5 stars,"Reviewed in India on August 27, 2021",Verified Purchase,"Jar quality is very poor, after one day used jar metal has been rusting in some places,also jar  metal is very thin.",
Rahul Sharma,Defective Product one speed options doesn't work,1.0 out of 5 stars,"Reviewed in India on October 30, 2015",Verified Purchase,"Product is defective and doesn't work on Speed 2, however Speed 1 & 3 works ok. Seems like they are selling refurbished product. Also I checked this today and my return period ended yesterday as it is only 10 days.",5 people found this helpful
Amazon Customer,Giving review after 4 year of use,5.0 out of 5 stars,"Reviewed in India on June 29, 2021",Verified Purchase,"Very good quality product. Using this product from 4 year. Ipurchased in 2017.
I think this mixer is the best I have ever purchased from Amazon.",
ANILKUAMR,not good,2.0 out of 5 stars,"Reviewed in India on January 6, 2021",Verified Purchase,i use this product only 4 month work after not work and i contact customer care ang give call ID - LUC0201210023295082-1  but not response after 5 days any service team/engineer so very bad service bajaj electrical,
Akash Mall,Broken jar and missing jar lids,1.0 out of 5 stars,"Reviewed in India on October 12, 2021",Verified Purchase,I got a broken jar and to my astonishment the jars didn't even have lids....i wonder how the customer is supposed to grind without lids. Nevertheless applied for a refund..hope it initiates soon,
Gayatri pande,Very disappointed.,1.0 out of 5 stars,"Reviewed in India on May 24, 2020",Verified Purchase,Pots are of very low quality..it got broken from bottom in first use only..I have wasted my 1900 rs and I cant cancel the item so I ordered for replacement.Contacted customer care no one is giving reply..very frustrating.Now I will never buy any item from amazon..very disappointed,
Lopamudra,Damaged product received for the second time,2.0 out of 5 stars,"Reviewed in India on June 20, 2021",Verified Purchase,Very much disappointed with the delivered product. Received a damaged piece for the second time.,
Gaurav Borde,Its a nice product would recommend it.,5.0 out of 5 stars,"Reviewed in India on August 22, 2020",Verified Purchase,Using it more than 8 months now and no problems faced. No manufacturing defect of any kind. I would recommend it for purchase.,
Priti,Must buy..,5.0 out of 5 stars,"Reviewed in India on March 29, 2022",Verified Purchase,"Easy to handle and easy to clean. Also works when used in heavy-duty. But Chutney jar lid is little bit loose, need to hold it tightly when jar is half full.",
